{
  "format": "schematic3d-build",
  "schemaVersion": 1,
  "name": "Watch Tower 9×18×9",
  "targetEdition": "bedrock",
  "dimensions": {
    "x": 9,
    "y": 18,
    "z": 9
  },
  "palette": [
    {
      "id": "minecraft:cobblestone"
    },
    {
      "id": "minecraft:mossy_cobblestone"
    },
    {
      "id": "minecraft:spruce_log"
    },
    {
      "id": "minecraft:spruce_planks"
    },
    {
      "id": "minecraft:glass"
    },
    {
      "id": "minecraft:torch"
    }
  ],
  "blocks": [
    {
      "x": 0,
      "y": 0,
      "z": 0,
      "paletteIndex": 1
    },
    {
      "x": 0,
      "y": 0,
      "z": 1,
      "paletteIndex": 0
    },
    {
      "x": 0,
      "y": 0,
      "z": 2,
      "paletteIndex": 0
    },
    {
      "x": 0,
      "y": 0,
      "z": 3,
      "paletteIndex": 0
    },
    {
      "x": 0,
      "y": 0,
      "z": 4,
      "paletteIndex": 0
    },
    {
      "x": 0,
      "y": 0,
      "z": 5,
      "paletteIndex": 0
    },
    {
      "x": 0,
      "y": 0,
      "z": 6,
      "paletteIndex": 0
    },
    {
      "x": 0,
      "y": 0,
      "z": 7,
      "paletteIndex": 1
    },
    {
      "x": 0,
      "y": 0,
      "z": 8,
      "paletteIndex": 0
    },
    {
      "x": 1,
      "y": 0,
      "z": 0,
      "paletteIndex": 0
    },
    {
      "x": 1,
      "y": 0,
      "z": 8,
      "paletteIndex": 0
    },
    {
      "x": 2,
      "y": 0,
      "z": 0,
      "paletteIndex": 0
    },
    {
      "x": 2,
      "y": 0,
      "z": 8,
      "paletteIndex": 0
    },
    {
      "x": 3,
      "y": 0,
      "z": 0,
      "paletteIndex": 0
    },
    {
      "x": 3,
      "y": 0,
      "z": 8,
      "paletteIndex": 0
    },
    {
      "x": 4,
      "y": 0,
      "z": 0,
      "paletteIndex": 0
    },
    {
      "x": 4,
      "y": 0,
      "z": 8,
      "paletteIndex": 0
    },
    {
      "x": 5,
      "y": 0,
      "z": 0,
      "paletteIndex": 0
    },
    {
      "x": 5,
      "y": 0,
      "z": 8,
      "paletteIndex": 0
    },
    {
      "x": 6,
      "y": 0,
      "z": 0,
      "paletteIndex": 0
    },
    {
      "x": 6,
      "y": 0,
      "z": 8,
      "paletteIndex": 1
    },
    {
      "x": 7,
      "y": 0,
      "z": 0,
      "paletteIndex": 1
    },
    {
      "x": 7,
      "y": 0,
      "z": 8,
      "paletteIndex": 0
    },
    {
      "x": 8,
      "y": 0,
      "z": 0,
      "paletteIndex": 0
    },
    {
      "x": 8,
      "y": 0,
      "z": 1,
      "paletteIndex": 0
    },
    {
      "x": 8,
      "y": 0,
      "z": 2,
      "paletteIndex": 0
    },
    {
      "x": 8,
      "y": 0,
      "z": 3,
      "paletteIndex": 0
    },
    {
      "x": 8,
      "y": 0,
      "z": 4,
      "paletteIndex": 0
    },
    {
      "x": 8,
      "y": 0,
      "z": 5,
      "paletteIndex": 0
    },
    {
      "x": 8,
      "y": 0,
      "z": 6,
      "paletteIndex": 1
    },
    {
      "x": 8,
      "y": 0,
      "z": 7,
      "paletteIndex": 0
    },
    {
      "x": 8,
      "y": 0,
      "z": 8,
      "paletteIndex": 0
    },
    {
      "x": 0,
      "y": 1,
      "z": 0,
      "paletteIndex": 0
    },
    {
      "x": 0,
      "y": 1,
      "z": 1,
      "paletteIndex": 0
    },
    {
      "x": 0,
      "y": 1,
      "z": 2,
      "paletteIndex": 0
    },
    {
      "x": 0,
      "y": 1,
      "z": 3,
      "paletteIndex": 0
    },
    {
      "x": 0,
      "y": 1,
      "z": 4,
      "paletteIndex": 1
    },
    {
      "x": 0,
      "y": 1,
      "z": 5,
      "paletteIndex": 0
    },
    {
      "x": 0,
      "y": 1,
      "z": 6,
      "paletteIndex": 0
    },
    {
      "x": 0,
      "y": 1,
      "z": 7,
      "paletteIndex": 0
    },
    {
      "x": 0,
      "y": 1,
      "z": 8,
      "paletteIndex": 0
    },
    {
      "x": 1,
      "y": 1,
      "z": 0,
      "paletteIndex": 0
    },
    {
      "x": 1,
      "y": 1,
      "z": 8,
      "paletteIndex": 0
    },
    {
      "x": 2,
      "y": 1,
      "z": 0,
      "paletteIndex": 0
    },
    {
      "x": 2,
      "y": 1,
      "z": 8,
      "paletteIndex": 0
    },
    {
      "x": 3,
      "y": 1,
      "z": 0,
      "paletteIndex": 0
    },
    {
      "x": 3,
      "y": 1,
      "z": 8,
      "paletteIndex": 1
    },
    {
      "x": 4,
      "y": 1,
      "z": 0,
      "paletteIndex": 1
    },
    {
      "x": 4,
      "y": 1,
      "z": 8,
      "paletteIndex": 0
    },
    {
      "x": 5,
      "y": 1,
      "z": 0,
      "paletteIndex": 0
    },
    {
      "x": 5,
      "y": 1,
      "z": 8,
      "paletteIndex": 0
    },
    {
      "x": 6,
      "y": 1,
      "z": 0,
      "paletteIndex": 0
    },
    {
      "x": 6,
      "y": 1,
      "z": 8,
      "paletteIndex": 0
    },
    {
      "x": 7,
      "y": 1,
      "z": 0,
      "paletteIndex": 0
    },
    {
      "x": 7,
      "y": 1,
      "z": 8,
      "paletteIndex": 0
    },
    {
      "x": 8,
      "y": 1,
      "z": 0,
      "paletteIndex": 0
    },
    {
      "x": 8,
      "y": 1,
      "z": 1,
      "paletteIndex": 0
    },
    {
      "x": 8,
      "y": 1,
      "z": 2,
      "paletteIndex": 0
    },
    {
      "x": 8,
      "y": 1,
      "z": 3,
      "paletteIndex": 1
    },
    {
      "x": 8,
      "y": 1,
      "z": 4,
      "paletteIndex": 0
    },
    {
      "x": 8,
      "y": 1,
      "z": 5,
      "paletteIndex": 0
    },
    {
      "x": 8,
      "y": 1,
      "z": 6,
      "paletteIndex": 0
    },
    {
      "x": 8,
      "y": 1,
      "z": 7,
      "paletteIndex": 0
    },
    {
      "x": 8,
      "y": 1,
      "z": 8,
      "paletteIndex": 0
    },
    {
      "x": 0,
      "y": 2,
      "z": 0,
      "paletteIndex": 0
    },
    {
      "x": 0,
      "y": 2,
      "z": 1,
      "paletteIndex": 1
    },
    {
      "x": 0,
      "y": 2,
      "z": 2,
      "paletteIndex": 0
    },
    {
      "x": 0,
      "y": 2,
      "z": 3,
      "paletteIndex": 0
    },
    {
      "x": 0,
      "y": 2,
      "z": 4,
      "paletteIndex": 0
    },
    {
      "x": 0,
      "y": 2,
      "z": 5,
      "paletteIndex": 0
    },
    {
      "x": 0,
      "y": 2,
      "z": 6,
      "paletteIndex": 0
    },
    {
      "x": 0,
      "y": 2,
      "z": 7,
      "paletteIndex": 0
    },
    {
      "x": 0,
      "y": 2,
      "z": 8,
      "paletteIndex": 1
    },
    {
      "x": 1,
      "y": 2,
      "z": 0,
      "paletteIndex": 1
    },
    {
      "x": 1,
      "y": 2,
      "z": 8,
      "paletteIndex": 0
    },
    {
      "x": 2,
      "y": 2,
      "z": 0,
      "paletteIndex": 0
    },
    {
      "x": 2,
      "y": 2,
      "z": 8,
      "paletteIndex": 0
    },
    {
      "x": 3,
      "y": 2,
      "z": 0,
      "paletteIndex": 0
    },
    {
      "x": 3,
      "y": 2,
      "z": 8,
      "paletteIndex": 0
    },
    {
      "x": 4,
      "y": 2,
      "z": 0,
      "paletteIndex": 0
    },
    {
      "x": 4,
      "y": 2,
      "z": 8,
      "paletteIndex": 0
    },
    {
      "x": 5,
      "y": 2,
      "z": 0,
      "paletteIndex": 0
    },
    {
      "x": 5,
      "y": 2,
      "z": 8,
      "paletteIndex": 0
    },
    {
      "x": 6,
      "y": 2,
      "z": 0,
      "paletteIndex": 0
    },
    {
      "x": 6,
      "y": 2,
      "z": 8,
      "paletteIndex": 0
    },
    {
      "x": 7,
      "y": 2,
      "z": 0,
      "paletteIndex": 0
    },
    {
      "x": 7,
      "y": 2,
      "z": 8,
      "paletteIndex": 1
    },
    {
      "x": 8,
      "y": 2,
      "z": 0,
      "paletteIndex": 1
    },
    {
      "x": 8,
      "y": 2,
      "z": 1,
      "paletteIndex": 0
    },
    {
      "x": 8,
      "y": 2,
      "z": 2,
      "paletteIndex": 0
    },
    {
      "x": 8,
      "y": 2,
      "z": 3,
      "paletteIndex": 0
    },
    {
      "x": 8,
      "y": 2,
      "z": 4,
      "paletteIndex": 0
    },
    {
      "x": 8,
      "y": 2,
      "z": 5,
      "paletteIndex": 0
    },
    {
      "x": 8,
      "y": 2,
      "z": 6,
      "paletteIndex": 0
    },
    {
      "x": 8,
      "y": 2,
      "z": 7,
      "paletteIndex": 1
    },
    {
      "x": 8,
      "y": 2,
      "z": 8,
      "paletteIndex": 0
    },
    {
      "x": 0,
      "y": 3,
      "z": 0,
      "paletteIndex": 0
    },
    {
      "x": 0,
      "y": 3,
      "z": 1,
      "paletteIndex": 0
    },
    {
      "x": 0,
      "y": 3,
      "z": 2,
      "paletteIndex": 0
    },
    {
      "x": 0,
      "y": 3,
      "z": 3,
      "paletteIndex": 0
    },
    {
      "x": 0,
      "y": 3,
      "z": 4,
      "paletteIndex": 0
    },
    {
      "x": 0,
      "y": 3,
      "z": 5,
      "paletteIndex": 1
    },
    {
      "x": 0,
      "y": 3,
      "z": 6,
      "paletteIndex": 0
    },
    {
      "x": 0,
      "y": 3,
      "z": 7,
      "paletteIndex": 0
    },
    {
      "x": 0,
      "y": 3,
      "z": 8,
      "paletteIndex": 0
    },
    {
      "x": 1,
      "y": 3,
      "z": 0,
      "paletteIndex": 0
    },
    {
      "x": 1,
      "y": 3,
      "z": 8,
      "paletteIndex": 0
    },
    {
      "x": 2,
      "y": 3,
      "z": 0,
      "paletteIndex": 0
    },
    {
      "x": 2,
      "y": 3,
      "z": 8,
      "paletteIndex": 0
    },
    {
      "x": 3,
      "y": 3,
      "z": 0,
      "paletteIndex": 0
    },
    {
      "x": 3,
      "y": 3,
      "z": 8,
      "paletteIndex": 0
    },
    {
      "x": 4,
      "y": 3,
      "z": 0,
      "paletteIndex": 0
    },
    {
      "x": 4,
      "y": 3,
      "z": 8,
      "paletteIndex": 1
    },
    {
      "x": 5,
      "y": 3,
      "z": 0,
      "paletteIndex": 1
    },
    {
      "x": 5,
      "y": 3,
      "z": 8,
      "paletteIndex": 0
    },
    {
      "x": 6,
      "y": 3,
      "z": 0,
      "paletteIndex": 0
    },
    {
      "x": 6,
      "y": 3,
      "z": 8,
      "paletteIndex": 0
    },
    {
      "x": 7,
      "y": 3,
      "z": 0,
      "paletteIndex": 0
    },
    {
      "x": 7,
      "y": 3,
      "z": 8,
      "paletteIndex": 0
    },
    {
      "x": 8,
      "y": 3,
      "z": 0,
      "paletteIndex": 0
    },
    {
      "x": 8,